current_occupant,business_name,tradestyle_name,duns,subject_address_full,website,phone,naics_code,naics_description,sic_code,sic_description,employees_at_location,year_started,type_of_location,company_address_line_1,company_address_city,company_address_state,company_address_postal_code,subject_address_line_1,subject_address_city,subject_address_state,subject_address_postal_code,reonomy_property_id,apn,longitude,latitude
Renier Construction Corporation,Renier Construction Corporation,,097547038,"2120 CITYGATE DR, COLUMBUS, OH 43219",www.renier.com,6148664580,236220,Commercial and Institutional Building Construction,15420101,"Commercial and office building, new construction",34,1980,Single Location,2164 Citygate Dr,Columbus,OH,43219,2120 Citygate Dr,Columbus,OH,43219,afea5aa9-051f-5c9d-b96e-0e6e58daa69e,010-265872,-82.916543,40.014025
Sahra Transport LLC,Sahra Transport LLC,,090451905,"2120 CITYGATE DR, COLUMBUS, OH 43219",,,488999,All Other Support Activities for Transportation,47890000,"Transportation services, nec",2,2020,Single Location,2184 Citygate Dr,Columbus,OH,43219,2120 Citygate Dr,Columbus,OH,43219,afea5aa9-051f-5c9d-b96e-0e6e58daa69e,010-265872,-82.917438,40.014085
Creativedrive,Creativedrive,,035483717,"2120 CITYGATE DR, COLUMBUS, OH 43219",,6144980822,541921,"Photography Studios, Portrait",72210000,"Photographic studios, portrait",1,2019,Single Location,2152 Citygate Dr,Columbus,OH,43219,2120 Citygate Dr,Columbus,OH,43219,afea5aa9-051f-5c9d-b96e-0e6e58daa69e,010-265872,-82.916513,40.014512
"Ortal Usa, Inc.","Ortal Usa, Inc.",,041586655,"2120 CITYGATE DR, COLUMBUS, OH 43219",www.ortalheat.com,8187727211,449129,All Other Home Furnishings Retailers,57190301,Fireplace equipment and accessories,10,2021,Single Location,2152 Citygate Dr,Columbus,OH,43219,2120 Citygate Dr,Columbus,OH,43219,afea5aa9-051f-5c9d-b96e-0e6e58daa69e,010-265872,-82.916513,40.014512
Mammoth Inc,Mammoth Inc,Mammoth Restoration,180049991,"2120 CITYGATE DR, COLUMBUS, OH 43219",www.mammothrestoration.com,8884955211,236220,Commercial and Institutional Building Construction,15420101,"Commercial and office building, new construction",12,1981,Single Location,2212 Citygate Dr,Columbus,OH,43219,2120 Citygate Dr,Columbus,OH,43219,afea5aa9-051f-5c9d-b96e-0e6e58daa69e,010-265872,-82.917972,40.014658
Renier Leasing Company,Renier Leasing Company,,927890921,"2120 CITYGATE DR, COLUMBUS, OH 43219",www.renier.com,,532111,Passenger Car Rental,75140000,Passenger car rental,20,1995,Single Location,2164 Citygate Dr,Columbus,OH,43219,2120 Citygate Dr,Columbus,OH,43219,afea5aa9-051f-5c9d-b96e-0e6e58daa69e,010-265872,-82.91715,40.013685
Hampton Inn Columbus East,Hampton Inn Columbus East,Hampton By Hilton,020660863,"2120 CITYGATE DR, COLUMBUS, OH 43219",www.hilton.com,6144187250,721110,Hotels (except Casino Hotels) and Motels,70110000,Hotels and motels,2,2011,Single Location,2168 Citygate Dr,Columbus,OH,43219,2120 Citygate Dr,Columbus,OH,43219,afea5aa9-051f-5c9d-b96e-0e6e58daa69e,010-265872,-82.916747,40.014056
"Ksc Studio, L.L.C.","Ksc Studio, L.L.C.",,043113540,"2120 CITYGATE DR, COLUMBUS, OH 43219",,9255802623,812990,All Other Personal Services,72999901,Apartment locating service,3,,Branch,2236 Citygate Dr,Columbus,OH,43219,2120 Citygate Dr,Columbus,OH,43219,afea5aa9-051f-5c9d-b96e-0e6e58daa69e,010-265872,-82.917889,40.015471
"Durr Megtec, LLC","Durr Megtec, LLC",Solvent Recovery Division,941581139,"2120 CITYGATE DR, COLUMBUS, OH 43219",www.durr-megtec.com,6143404154,324110,Petroleum Refineries,29110206,Solvents,7,,Branch,2120 Citygate Dr,Columbus,OH,43219,2120 Citygate Dr,Columbus,OH,43219,afea5aa9-051f-5c9d-b96e-0e6e58daa69e,010-265872,-82.917139,40.014779
"Trulite Glass & Aluminum Solutions, LLC","Trulite Glass & Aluminum Solutions, LLC",,013043000,"160 N HIGH ST, HEBRON, OH 43025",www.trulite.com,,327211,Flat Glass Manufacturing,32110202,Tempered glass,54,,Branch,160 N High St,Hebron,OH,43025,160 N High St,Hebron,OH,43025,a7585fd3-5a1a-5c32-aaa7-6728c196f53c,075-345324-00.000,-82.488973,39.967362
The American National Red Cross,The American National Red Cross,American Nat Red Cross - Blood,963972091,"4321 EQUITY DR, COLUMBUS, OH 43228",www.redcross.org,6143340425,624190,Other Individual and Family Services,83220610,Social service center,56,,Branch,4327 Equity Dr,Columbus,OH,43228,4321 Equity Dr,Columbus,OH,43228,46128bfe-eceb-5da6-bbe7-4b7bf363b0ed,560-184535,-83.119679,39.986625
"Tpusa, Inc.","Tpusa, Inc.",Teleperformance USA,623590606,"4321 EQUITY DR, COLUMBUS, OH 43228",www.teleperformance.com,6146215512,561422,Telemarketing Bureaus and Other Contact Centers,73891005,Telemarketing services,648,,Branch,4335 Equity Dr,Columbus,OH,43228,4321 Equity Dr,Columbus,OH,43228,46128bfe-eceb-5da6-bbe7-4b7bf363b0ed,560-184535,-83.119628,39.987691
"Kin Custom, Inc.","Kin Custom, Inc.",Kin Custom,099524041,"4321 EQUITY DR, COLUMBUS, OH 43228",www.kincustom.com,6149715117,541490,Other Specialized Design Services,73890409,"Styling of fashions, apparel, furniture, textiles, etc.",14,2018,Single Location,4341 Equity Dr,Columbus,OH,43228,4321 Equity Dr,Columbus,OH,43228,46128bfe-eceb-5da6-bbe7-4b7bf363b0ed,560-184535,-83.120179,39.987961
Valex LLC,Valex LLC,,086344106,"4321 EQUITY DR, COLUMBUS, OH 43228",www.valexsands.com,4126101139,541512,Computer Systems Design Services,73730100,Systems software development services,5,2015,Single Location,4331 Equity Dr,Columbus,OH,43228,4321 Equity Dr,Columbus,OH,43228,46128bfe-eceb-5da6-bbe7-4b7bf363b0ed,560-184535,-83.119668,39.98698
"Floyd Bell, Inc.","Floyd Bell, Inc.",,059937128,"710 DEARBORN PARK LN, COLUMBUS, OH 43085",www.floydbell.com,6142944000,334290,Other Communications Equipment Manufacturing,36690100,Emergency alarms,50,1971,HQ,720 Dearborn Park Ln,Columbus,OH,43085,710 Dearborn Park Ln,Columbus,OH,43085,5ddd0574-d20c-59cd-a16c-3ca3944e61b5,610-207087,-82.998062,40.116812
"Lansing Building Products, LLC","Lansing Building Products, LLC",,603457842,"710 DEARBORN PARK LN, COLUMBUS, OH 43085",www.lansingbp.com,6147819450,444180,Other Building Material Dealers,52110000,Lumber and other building materials,6,,Branch,710 Dearborn Park Ln,Columbus,OH,43085,710 Dearborn Park Ln,Columbus,OH,43085,5ddd0574-d20c-59cd-a16c-3ca3944e61b5,610-207087,-82.997137,40.117033
"Safelite Fulfillment, Inc.","Safelite Fulfillment, Inc.",Safelite Autoglass,026381710,"710 DEARBORN PARK LN, COLUMBUS, OH 43085",www.safelite.com,6147815449,811122,Automotive Glass Replacement Shops,75360000,Automotive glass replacement shops,19,,Branch,760 Dearborn Park Ln,Columbus,OH,43085,710 Dearborn Park Ln,Columbus,OH,43085,5ddd0574-d20c-59cd-a16c-3ca3944e61b5,610-207087,-82.996226,40.11673
Dal-Tile Corporation,Dal-Tile Corporation,Daltile Sales Service Center,619236086,"710 DEARBORN PARK LN, COLUMBUS, OH 43085",locations.daltile.com,6144339181,238340,Tile and Terrazzo Contractors,17439904,"Tile installation, ceramic",9,,Branch,730 Dearborn Park Ln,Columbus,OH,43085,710 Dearborn Park Ln,Columbus,OH,43085,5ddd0574-d20c-59cd-a16c-3ca3944e61b5,610-207087,-82.997401,40.116785
Screen Machine Industries LLC,Screen Machine Industries LLC,Screen Machine,013042470,"10685 COLUMBUS PKWY, PATASKALA, OH 43062",www.screenmachine.com,7409273464,323111,Commercial Printing (except Screen and Books),27520100,Offset and photolithographic printing,4,2013,Single Location,10685 Columbus Pkwy,Pataskala,OH,43062,10685 Columbus Pkwy,Pataskala,OH,43062,146013ad-0dd9-58cf-a579-11a919cb0ef8,010-018048-00.001,-82.691632,39.947812
"SMI Holdings, Inc.","SMI Holdings, Inc.",Screen Machine,004489159,"10685 COLUMBUS PKWY, PATASKALA, OH 43062",www.screenmachine.com,7409273464,323111,Commercial Printing (except Screen and Books),27520100,Offset and photolithographic printing,100,1966,HQ,10685 Columbus Pkwy,Pataskala,OH,43062,10685 Columbus Pkwy,Pataskala,OH,43062,146013ad-0dd9-58cf-a579-11a919cb0ef8,010-018048-00.001,-82.691632,39.947812
"Contract Building Components, Ltd.","Contract Building Components, Ltd.",C B C,006939362,"14540 INDUSTRIAL PKWY, MARYSVILLE, OH 43040",www.contractbuilding.com,9376440739,321215,Engineered Wood Member Manufacturing,24399904,"Trusses, wooden roof",20,2000,Single Location,14540 Industrial Pkwy,Marysville,OH,43040,14540 Industrial Pkwy,Marysville,OH,43040,65dc184e-0553-510e-91c3-9b497a5cc501,29-0023057-1000,-83.325594,40.216704
"Luvata Ohio, Inc.","Luvata Ohio, Inc.",Luvata,004286043,"1376 PITTSBURGH DR, DELAWARE, OH 43015",www.luvata.com,7403631981,333992,Welding and Soldering Equipment Manufacturing,35489903,"Welding and cutting apparatus and accessories, nec",85,2016,HQ,1376 Pittsburgh Dr,Delaware,OH,43015,1376 Pittsburgh Dr,Delaware,OH,43015,49308fc3-b6a7-5243-9dec-7fc4bcef9d1b,419-220-01-017-002,-83.114877,40.284007
U-Store-It Mini Warehouse Co.,U-Store-It Mini Warehouse Co.,,788658008,"5411 W BROAD ST, COLUMBUS, OH 43228",,6148700221,531130,Lessors of Miniwarehouses and Self-Storage Units,42259903,"Warehousing, self storage",2,,Branch,5411 W Broad St,Columbus,OH,43228,5411 W Broad St,Columbus,OH,43228,7c9e0143-a5fe-504e-841c-3a11bc962f66,570-243347,-83.145198,39.950398
West Broad Mini Storage,West Broad Mini Storage,,162843549,"5411 W BROAD ST, COLUMBUS, OH 43228",,6148700221,531130,Lessors of Miniwarehouses and Self-Storage Units,42259903,"Warehousing, self storage",2,2004,Single Location,5411 W Broad St,Columbus,OH,43228,5411 W Broad St,Columbus,OH,43228,7c9e0143-a5fe-504e-841c-3a11bc962f66,570-243347,-83.145198,39.950398
"Ats Ohio, Inc.","Ats Ohio, Inc.",Automation Tooling Systems,054020458,"425 ENTERPRISE DR, LEWIS CENTER, OH 43035",www.atsautomation.com,6148882344,333912,Air and Gas Compressor Manufacturing,35630202,"Robots for industrial spraying, painting, etc.",125,1974,Single Location,425 Enterprise Dr,Lewis Center,OH,43035,425 Enterprise Dr,Lewis Center,OH,43035,b22cb7a6-0c90-58d3-a92d-3ce9ae307967,318-342-03-004-000,-83.007903,40.152958
PA Solutions Inc,PA Solutions Inc,,096800629,"425 ENTERPRISE DR, LEWIS CENTER, OH 43035",,6147818037,999990,Unclassified Establishments,99992222,"Duns Support Record, nonclassifiable establishment",7,2019,Single Location,425 Enterprise Dr,Lewis Center,OH,43035,425 Enterprise Dr,Lewis Center,OH,43035,b22cb7a6-0c90-58d3-a92d-3ce9ae307967,318-342-03-004-000,-83.007903,40.152958
"Ats Carolina, Inc.","Ats Carolina, Inc.",Automation Tooling Systems,023164450,"425 ENTERPRISE DR, LEWIS CENTER, OH 43035",www.atsautomation.com,8033249300,541512,Computer Systems Design Services,73730200,Systems integration services,63,1997,Single Location,425 Enterprise Dr,Lewis Center,OH,43035,425 Enterprise Dr,Lewis Center,OH,43035,b22cb7a6-0c90-58d3-a92d-3ce9ae307967,318-342-03-004-000,-83.007903,40.152958
"Automation Tooling Systems, Inc","Automation Tooling Systems, Inc",Ats Ohio,622217297,"425 ENTERPRISE DR, LEWIS CENTER, OH 43035",www.atsautomation.com,6147818063,423830,Industrial Machinery and Equipment Merchant Wholesalers,50840000,Industrial machinery and equipment,140,1987,HQ,425 Enterprise Dr,Lewis Center,OH,43035,425 Enterprise Dr,Lewis Center,OH,43035,b22cb7a6-0c90-58d3-a92d-3ce9ae307967,318-342-03-004-000,-83.007903,40.152958
Ats Systems Oregon Inc.,Ats Systems Oregon Inc.,,173280603,"425 ENTERPRISE DR, LEWIS CENTER, OH 43035",www.atsautomation.com,5417380932,333998,All Other Miscellaneous General Purpose Machinery Manufacturing,35699914,"Robots, assembly line: industrial and commercial",270,1996,Single Location,425 Enterprise Dr,Lewis Center,OH,43035,425 Enterprise Dr,Lewis Center,OH,43035,b22cb7a6-0c90-58d3-a92d-3ce9ae307967,318-342-03-004-000,-83.007903,40.152958
Wrkco Inc.,Wrkco Inc.,,080863170,"495 E COSHOCTON ST, JOHNSTOWN, OH 43031",,7409671105,722513,Limited-Service Restaurants,58120600,Pizza restaurants,7,,Branch,495 E Coshocton St,Johnstown,OH,43031,495 E Coshocton St,Johnstown,OH,43031,fc242fde-9087-54bc-acef-54ae34a35641,053-172644-00.004,-82.675753,40.157925
"Nissin International Transport U.S.A., Inc.","Nissin International Transport U.S.A., Inc.",Nissin International Transport,605166842,"16940 SQUARE DR, MARYSVILLE, OH 43040",www.nitusa.com,9376442644,488510,Freight Transportation Arrangement,47310200,Freight forwarding,75,,Branch,16940 Square Dr,Marysville,OH,43040,16940 Square Dr,Marysville,OH,43040,8673ba9d-17bc-52b4-a1df-bd8e103a2842,29-0016008-0000,-83.345647,40.246108
Trancy America Corp.,Trancy America Corp.,,020290473,"16940 SQUARE DR, MARYSVILLE, OH 43040",www.trancyamerica.com,9372099137,488999,All Other Support Activities for Transportation,47890000,"Transportation services, nec",2,2018,Single Location,16940 Square Dr,Marysville,OH,43040,16940 Square Dr,Marysville,OH,43040,8673ba9d-17bc-52b4-a1df-bd8e103a2842,29-0016008-0000,-83.345647,40.246108
Briskheat Corporation,Briskheat Corporation,,004291498,"4800 HILTON CORPORATE DR, COLUMBUS, OH 43232",www.briskheat.com,6142943376,333415,Air-Conditioning and Warm Air Heating Equipment and Commercial and Industrial Refrigeration Equipment Manufacturing,35850000,Refrigeration and heating equipment,159,2019,HQ,4800 Hilton Corporate Dr,Columbus,OH,43232,4800 Hilton Corporate Dr,Columbus,OH,43232,6c053523-a139-58de-9b0b-9ecb706e08b8,010-206956,-82.867292,39.934509
Romick Properties Limited Partnership,Romick Properties Limited Partnership,,085449105,"4800 HILTON CORPORATE DR, COLUMBUS, OH 43232",,,531312,Nonresidential Property Managers,65120000,Nonresidential building operators,2,1994,Single Location,4800 Hilton Corporate Dr,Columbus,OH,43232,4800 Hilton Corporate Dr,Columbus,OH,43232,6c053523-a139-58de-9b0b-9ecb706e08b8,010-206956,-82.867292,39.934509
"Irsg Holdings, LLC","Irsg Holdings, LLC",,062351109,"4800 HILTON CORPORATE DR, COLUMBUS, OH 43232",,4253981875,561499,All Other Business Support Services,73890100,"Personal service agents, brokers, and bureaus",2,2011,Single Location,4800 Hilton Corporate Dr,Columbus,OH,43232,4800 Hilton Corporate Dr,Columbus,OH,43232,6c053523-a139-58de-9b0b-9ecb706e08b8,010-206956,-82.867292,39.934509
Westerville Mini Storage,Westerville Mini Storage,,964113864,"5909 WESTERVILLE RD, WESTERVILLE, OH 43081",www.westervillenorthselfstorage.com,6148828675,531130,Lessors of Miniwarehouses and Self-Storage Units,42259903,"Warehousing, self storage",3,1996,Single Location,5909 Westerville Rd,Westerville,OH,43081,5909 Westerville Rd,Westerville,OH,43081,1ac45e04-c23f-50ee-bcec-4b61dba75b4b,110-005913,-82.926258,40.093813
Stop-N-Go Storage of Delaware LLC,Stop-N-Go Storage of Delaware LLC,,088968007,"5909 WESTERVILLE RD, WESTERVILLE, OH 43081",,,493110,General Warehousing and Storage,42250000,General warehousing and storage,2,2015,Single Location,5909 Westerville Rd,Westerville,OH,43081,5909 Westerville Rd,Westerville,OH,43081,1ac45e04-c23f-50ee-bcec-4b61dba75b4b,110-005913,-82.926258,40.093813
"Sunfield, Inc.","Sunfield, Inc.",,860091040,"116 ENTERPRISE DR, HEBRON, OH 43025",www.sunfieldinc.com,7409280404,332119,"Metal Crown, Closure, and Other Metal Stamping (except Automotive)",34699916,Stamping Metal for the trade,70,1993,Single Location,116 Enterprise Dr,Hebron,OH,43025,116 Enterprise Dr,Hebron,OH,43025,69b49e9f-4d7c-5d0b-a5d5-57dde82eec9d,075-344880-01.004,-82.477383,39.968446
U-Store-It Mini Warehouse Co.,U-Store-It Mini Warehouse Co.,,788658081,"5252 NIKE DR, HILLIARD, OH 43026",,6147719916,531130,Lessors of Miniwarehouses and Self-Storage Units,42259903,"Warehousing, self storage",3,,Branch,5252 Nike Dr,Hilliard,OH,43026,5252 Nike Dr,Hilliard,OH,43026,84fec174-841d-53f5-82a6-bfa6984ab2ea,560-160648,-83.149123,39.995594
Hilliard Mini Storage,Hilliard Mini Storage,,928354059,"5252 NIKE DR, HILLIARD, OH 43026",,6147719916,531130,Lessors of Miniwarehouses and Self-Storage Units,42259903,"Warehousing, self storage",6,1995,Single Location,5252 Nike Dr,Hilliard,OH,43026,5252 Nike Dr,Hilliard,OH,43026,84fec174-841d-53f5-82a6-bfa6984ab2ea,560-160648,-83.149123,39.995594
Cubesmart,Cubesmart,,083496434,"5252 NIKE DR, HILLIARD, OH 43026",www.cubesmart.com,6147711705,713930,Marinas,44939901,"Boat yards, storage and incidental repair",1,,Branch,5252 Nike Dr,Hilliard,OH,43026,5252 Nike Dr,Hilliard,OH,43026,84fec174-841d-53f5-82a6-bfa6984ab2ea,560-160648,-83.149123,39.995594
"Edwards, Mooney & Moses","Edwards, Mooney & Moses",Edwards Mooney & Moses of Ohio,081318131,"1320 MCKINLEY AVE, COLUMBUS, OH 43222",www.edwardsmooneyandmoses.com,6143511439,238310,Drywall and Insulation Contractors,17420203,"Insulation, buildings",402,1978,Single Location,1320 Mckinley Ave Ste B,Columbus,OH,43222,1320 Mckinley Ave,Columbus,OH,43222,6f9861ef-4809-5141-bcdd-3d7236bcba68,010-007252,-83.036748,39.964493
"Grytur Enterprises, Inc.","Grytur Enterprises, Inc.",Division 10 Plus,962744889,"1320 MCKINLEY AVE, COLUMBUS, OH 43222",,6146784471,327110,"Pottery, Ceramics, and Plumbing Fixture Manufacturing",32610100,"Bathroom accessories/fittings, vitreous china or earthenware",1,2010,Single Location,1320 Mckinley Ave,Columbus,OH,43222,1320 Mckinley Ave,Columbus,OH,43222,6f9861ef-4809-5141-bcdd-3d7236bcba68,010-007252,-83.036748,39.964493
Multicon Construction Co,Multicon Construction Co,Eclipse Real Estate Group,023159978,"1320 MCKINLEY AVE, COLUMBUS, OH 43222",www.multicon.build,,236117,New Housing For-Sale Builders,15310000,Operative builders,23,1988,Single Location,1320 Mckinley Ave Ste C,Columbus,OH,43222,1320 Mckinley Ave,Columbus,OH,43222,6f9861ef-4809-5141-bcdd-3d7236bcba68,010-007252,-83.036748,39.964493
"Installed Building Products, LLC","Installed Building Products, LLC",Swan Freedom,796147945,"1320 MCKINLEY AVE, COLUMBUS, OH 43222",www.swanfreedom.com,,337122,Nonupholstered Wood Household Furniture Manufacturing,25119909,Whatnot shelves: wood,7,,Branch,1320 Mckinley Ave Ste A,Columbus,OH,43222,1320 Mckinley Ave,Columbus,OH,43222,6f9861ef-4809-5141-bcdd-3d7236bcba68,010-007252,-83.036748,39.964493
Edwards Insulation Co,Edwards Insulation Co,,949755842,"1320 MCKINLEY AVE, COLUMBUS, OH 43222",,6143322543,238310,Drywall and Insulation Contractors,17420203,"Insulation, buildings",5,2012,Single Location,1320 Mckinley Ave,Columbus,OH,43222,1320 Mckinley Ave,Columbus,OH,43222,6f9861ef-4809-5141-bcdd-3d7236bcba68,010-007252,-83.036748,39.964493
"Installed Building Products, LLC","Installed Building Products, LLC",IBP Columbus,079292622,"1320 MCKINLEY AVE, COLUMBUS, OH 43222",www.installedbuildingproducts.com,,238310,Drywall and Insulation Contractors,17420203,"Insulation, buildings",24,,Branch,1320 Mckinley Ave Ste A,Columbus,OH,43222,1320 Mckinley Ave,Columbus,OH,43222,6f9861ef-4809-5141-bcdd-3d7236bcba68,010-007252,-83.036748,39.964493
Columbia Gas Meter Shop,Columbia Gas Meter Shop,,019182376,"5315 FISHER RD, COLUMBUS, OH 43228",,6144605519,211120,Crude Petroleum Extraction,13110000,Crude petroleum and natural gas,11,2009,Single Location,5315 Fisher Rd,Columbus,OH,43228,5315 Fisher Rd,Columbus,OH,43228,5704ac01-3fc4-5581-a0a4-9a2b1b96b44c,570-215151,-83.140738,39.973579
Nisource Inc.,Nisource Inc.,,059671601,"5315 FISHER RD, COLUMBUS, OH 43228",www.nisource.com,6144605517,221118,Other Electric Power Generation,49119902,"Generation, electric power",5,,Branch,5315 Fisher Rd,Columbus,OH,43228,5315 Fisher Rd,Columbus,OH,43228,5704ac01-3fc4-5581-a0a4-9a2b1b96b44c,570-215151,-83.140738,39.973579
American Community Newspapers,American Community Newspapers,,948870220,"5235 SINCLAIR RD, COLUMBUS, OH 43229",,6148884567,513110,Newspaper Publishers,27110100,"Newspapers, publishing and printing",4,2009,Single Location,5255 Sinclair Rd,Columbus,OH,43229,5235 Sinclair Rd,Columbus,OH,43229,c77a757e-c06f-539d-b63b-ed8cc643fe01,010-118483,-82.998788,40.072093
Speer Industries Incorporated,Speer Industries Incorporated,Speer Mechanical,117366757,"5235 SINCLAIR RD, COLUMBUS, OH 43229",www.speermechanical.com,6142616331,238220,"Plumbing, Heating, and Air-Conditioning Contractors",17110401,Mechanical contractor,45,1927,HQ,5255 Sinclair Rd,Columbus,OH,43229,5235 Sinclair Rd,Columbus,OH,43229,c77a757e-c06f-539d-b63b-ed8cc643fe01,010-118483,-82.998788,40.072093
Schmid Mechanical Co.,Schmid Mechanical Co.,,051150064,"5235 SINCLAIR RD, COLUMBUS, OH 43229",www.speermechanical.com,,238220,"Plumbing, Heating, and Air-Conditioning Contractors",17110401,Mechanical contractor,50,2010,Single Location,5255 Sinclair Rd,Columbus,OH,43229,5235 Sinclair Rd,Columbus,OH,43229,c77a757e-c06f-539d-b63b-ed8cc643fe01,010-118483,-82.998788,40.072093
C M Limited,C M Limited,,161874417,"5235 SINCLAIR RD, COLUMBUS, OH 43229",,6148884567,531120,Lessors of Nonresidential Buildings (except Miniwarehouses),65120100,Commercial and industrial building operation,45,1980,Single Location,5255 Sinclair Rd,Columbus,OH,43229,5235 Sinclair Rd,Columbus,OH,43229,c77a757e-c06f-539d-b63b-ed8cc643fe01,010-118483,-82.998788,40.072093
The Dispatch Printing Company,The Dispatch Printing Company,CM Printing,825569452,"5235 SINCLAIR RD, COLUMBUS, OH 43229",www.dispatch.com,,513110,Newspaper Publishers,27110101,Commercial printing and newspaper publishing combined,3,,Branch,5253 Sinclair Rd,Columbus,OH,43229,5235 Sinclair Rd,Columbus,OH,43229,c77a757e-c06f-539d-b63b-ed8cc643fe01,010-118483,-82.999788,40.071965
Julian Speer Mech Service,Julian Speer Mech Service,,040062100,"5235 SINCLAIR RD, COLUMBUS, OH 43229",www.speermechanical.com,6144364084,238220,"Plumbing, Heating, and Air-Conditioning Contractors",17110401,Mechanical contractor,2,2013,Single Location,5255 Sinclair Rd,Columbus,OH,43229,5235 Sinclair Rd,Columbus,OH,43229,c77a757e-c06f-539d-b63b-ed8cc643fe01,010-118483,-82.998788,40.072093
"Diamondback Golf, LLC","Diamondback Golf, LLC",,023981718,"5235 SINCLAIR RD, COLUMBUS, OH 43229",,,999990,Unclassified Establishments,99992222,"Duns Support Record, nonclassifiable establishment",2,2012,Single Location,5253 Sinclair Rd,Columbus,OH,43229,5235 Sinclair Rd,Columbus,OH,43229,c77a757e-c06f-539d-b63b-ed8cc643fe01,010-118483,-82.998117,40.072326
Speer Julian Co,Speer Julian Co,Speer Mechanical,004488706,"5235 SINCLAIR RD, COLUMBUS, OH 43229",,6142616331,238220,"Plumbing, Heating, and Air-Conditioning Contractors",17110401,Mechanical contractor,55,1957,Single Location,5255 Sinclair Rd,Columbus,OH,43229,5235 Sinclair Rd,Columbus,OH,43229,c77a757e-c06f-539d-b63b-ed8cc643fe01,010-118483,-82.998788,40.072093
"Four Brothers Investment, LLC","Four Brothers Investment, LLC",,074041619,"4231 LEAP RD, HILLIARD, OH 43026",,6149219751,523910,Miscellaneous Intermediation,67990000,"Investors, nec",2,2014,Single Location,4231 Leap Rd Ste A,Hilliard,OH,43026,4231 Leap Rd,Hilliard,OH,43026,7aacf817-683c-5dbf-901a-4ca83ec82292,050-003796,-83.14082,40.0406
Hmb Real Estate LLC,Hmb Real Estate LLC,,088659161,"4231 LEAP RD, HILLIARD, OH 43026",,,531210,Offices of Real Estate Agents and Brokers,65310100,Real estate brokers and agents,2,2013,Single Location,4231 Leap Rd,Hilliard,OH,43026,4231 Leap Rd,Hilliard,OH,43026,7aacf817-683c-5dbf-901a-4ca83ec82292,050-003796,-83.140214,40.040087
"Leap Road Investment Company, Inc.","Leap Road Investment Company, Inc.",,117668246,"4231 LEAP RD, HILLIARD, OH 43026",,6142554373,531210,Offices of Real Estate Agents and Brokers,65310000,Real estate agents and managers,1,1986,Single Location,4231 Leap Rd,Hilliard,OH,43026,4231 Leap Rd,Hilliard,OH,43026,7aacf817-683c-5dbf-901a-4ca83ec82292,050-003796,-83.140214,40.040087
Ay Fashion and Accessories Inc,Ay Fashion and Accessories Inc,,046538830,"4231 LEAP RD, HILLIARD, OH 43026",,6144029363,458110,Clothing and Clothing Accessories Retailers,56210000,Women's clothing stores,2,2014,Single Location,4231 Leap Rd Ste C,Hilliard,OH,43026,4231 Leap Rd,Hilliard,OH,43026,7aacf817-683c-5dbf-901a-4ca83ec82292,050-003796,-83.14082,40.0406
Above Sound LLC,Above Sound LLC,,930659730,"4231 LEAP RD, HILLIARD, OH 43026",www.aslpros.com,6149910676,238210,Electrical Contractors and Other Wiring Installation Contractors,17310303,Sound equipment specialization,8,2012,Single Location,4231 Leap Rd Ste C,Hilliard,OH,43026,4231 Leap Rd,Hilliard,OH,43026,7aacf817-683c-5dbf-901a-4ca83ec82292,050-003796,-83.14082,40.0406
Vince World Electronic Inc.,Vince World Electronic Inc.,,076894926,"4231 LEAP RD, HILLIARD, OH 43026",,,459999,All Other Miscellaneous Retailers,59999910,Electronic parts and equipment,1,2019,Single Location,4233 Leap Rd,Hilliard,OH,43026,4231 Leap Rd,Hilliard,OH,43026,7aacf817-683c-5dbf-901a-4ca83ec82292,050-003796,-83.141103,40.041103
Ustrg u.s. Technology Recycling Group Ltd,Ustrg u.s. Technology Recycling Group Ltd,Ustrg,809850261,"4231 LEAP RD, HILLIARD, OH 43026",www.ustrg.com,6148500202,423430,Computer and Computer Peripheral Equipment and Software Merchant Wholesalers,50459905,"Computers, nec",5,2007,Single Location,4231 Leap Rd Ste H,Hilliard,OH,43026,4231 Leap Rd,Hilliard,OH,43026,7aacf817-683c-5dbf-901a-4ca83ec82292,050-003796,-83.14082,40.0406
"A.M.B. and Brothers, Inc.","A.M.B. and Brothers, Inc.",A M B,837984483,"4231 LEAP RD, HILLIARD, OH 43026",,6149219751,493110,General Warehousing and Storage,42259901,General warehousing,9,1991,Single Location,4231 Leap Rd Ste A,Hilliard,OH,43026,4231 Leap Rd,Hilliard,OH,43026,7aacf817-683c-5dbf-901a-4ca83ec82292,050-003796,-83.14082,40.0406
"Hyperlogistics Group, Inc.","Hyperlogistics Group, Inc.",,179456496,"2300 RICKENBACKER PKWY, COLUMBUS, OH 43217",www.hyperlog.com,6144914272,488490,Other Support Activities for Road Transportation,42310000,Trucking terminal facilities,2,,Branch,2300 Rickenbacker Pkwy,Columbus,OH,43217,2300 Rickenbacker Pkwy,Columbus,OH,43217,347dd114-efb6-53c8-b28b-af522aaa0ad4,495-242618,-82.936627,39.82394
