current_occupant,business_name,tradestyle_name,duns,subject_address_full,website,phone,naics_code,naics_description,sic_code,sic_description,employees_at_location,year_started,type_of_location,company_address_line_1,company_address_city,company_address_state,company_address_postal_code,subject_address_line_1,subject_address_city,subject_address_state,subject_address_postal_code,reonomy_property_id,apn,longitude,latitude
The Carrington Real Estates Limited,The Carrington Real Estates Limited,,088576976,"921 EASTWIND DR, WESTERVILLE, OH 43081",,,531210,Offices of Real Estate Agents and Brokers,65310100,Real estate brokers and agents,2,2018,Single Location,921 Eastwind Dr Ste 118,Westerville,OH,43081,921 Eastwind Dr,Westerville,OH,43081,2486c612-a138-5b4a-9cca-cf6653a153c1,080-007421,-82.916723,40.100353
"Modern Office Methods, Inc.","Modern Office Methods, Inc.",,115500142,"921 EASTWIND DR, WESTERVILLE, OH 43081",www.momnet.com,6148913693,459999,All Other Miscellaneous Retailers,59991401,Business machines and equipment,58,,Branch,929 Eastwind Dr Ste 220,Westerville,OH,43081,921 Eastwind Dr,Westerville,OH,43081,2486c612-a138-5b4a-9cca-cf6653a153c1,080-007421,-82.916539,40.099504
"Aurora Exhibit Solutions, Inc.","Aurora Exhibit Solutions, Inc.",,834690091,"921 EASTWIND DR, WESTERVILLE, OH 43081",www.aurora-exhibits.com,,423440,Other Commercial Equipment Merchant Wholesalers,50460101,"Display equipment, except refrigerated",4,1994,Single Location,929 Eastwind Dr Ste 223,Westerville,OH,43081,921 Eastwind Dr,Westerville,OH,43081,2486c612-a138-5b4a-9cca-cf6653a153c1,080-007421,-82.915968,40.099748
ADC Fullfillment Svc.,ADC Fullfillment Svc.,,034278132,"921 EASTWIND DR, WESTERVILLE, OH 43081",,6148999900,541110,Offices of Lawyers,81110000,Legal services,1,2010,Single Location,929 Eastwind Dr Ste 220,Westerville,OH,43081,921 Eastwind Dr,Westerville,OH,43081,2486c612-a138-5b4a-9cca-cf6653a153c1,080-007421,-82.916539,40.099504
Tiger Run Owners Association,Tiger Run Owners Association,,077585921,"921 EASTWIND DR, WESTERVILLE, OH 43081",,6148999900,813910,Business Associations,86110103,Merchants' association,5,2015,Single Location,929 Eastwind Dr Ste 221,Westerville,OH,43081,921 Eastwind Dr,Westerville,OH,43081,2486c612-a138-5b4a-9cca-cf6653a153c1,080-007421,-82.916229,40.099578
Nationwide Staffing Agency Inc.,Nationwide Staffing Agency Inc.,,088210223,"921 EASTWIND DR, WESTERVILLE, OH 43081",,,561311,Employment Placement Agencies,73610000,Employment agencies,2,2019,Single Location,921 Eastwind Dr Ste 118,Westerville,OH,43081,921 Eastwind Dr,Westerville,OH,43081,2486c612-a138-5b4a-9cca-cf6653a153c1,080-007421,-82.916723,40.100353
Tk Elevator Corporation,Tk Elevator Corporation,,929861037,"921 EASTWIND DR, WESTERVILLE, OH 43081",www.tkelevator.com,6148958930,238290,Other Building Equipment Contractors,17969901,Elevator installation and conversion,37,,Branch,929 Eastwind Dr Ste 218,Westerville,OH,43081,921 Eastwind Dr,Westerville,OH,43081,2486c612-a138-5b4a-9cca-cf6653a153c1,080-007421,-82.916647,40.099515
Senior Life By Design LLC,Senior Life By Design LLC,,074765549,"921 EASTWIND DR, WESTERVILLE, OH 43081",,6146829615,541490,Other Specialized Design Services,73891800,Design services,2,2014,Single Location,921 Eastwind Dr Ste 101,Westerville,OH,43081,921 Eastwind Dr,Westerville,OH,43081,2486c612-a138-5b4a-9cca-cf6653a153c1,080-007421,-82.915469,40.100143
The Isaacs Company,The Isaacs Company,Isascs Fluid Power Eqp Co,018649652,"921 EASTWIND DR, WESTERVILLE, OH 43081",www.isaacsfluidpower.com,6148958540,423830,Industrial Machinery and Equipment Merchant Wholesalers,50849905,Hydraulic systems equipment and supplies,5,,Branch,929 Eastwind Dr Ste 205,Westerville,OH,43081,921 Eastwind Dr,Westerville,OH,43081,2486c612-a138-5b4a-9cca-cf6653a153c1,080-007421,-82.91762,40.099832
"Willbros Group, Inc.","Willbros Group, Inc.",,060519708,"921 EASTWIND DR, WESTERVILLE, OH 43081",www.willbros.com,,541330,Engineering Services,87110000,Engineering services,19,,Branch,921 Eastwind Dr Ste 122,Westerville,OH,43081,921 Eastwind Dr,Westerville,OH,43081,2486c612-a138-5b4a-9cca-cf6653a153c1,080-007421,-82.916954,40.10039
"Red 1 Realty Florida, LLC","Red 1 Realty Florida, LLC",,083321736,"921 EASTWIND DR, WESTERVILLE, OH 43081",,,531210,Offices of Real Estate Agents and Brokers,65310100,Real estate brokers and agents,2,2021,Single Location,921 Eastwind Dr Ste 112,Westerville,OH,43081,921 Eastwind Dr,Westerville,OH,43081,2486c612-a138-5b4a-9cca-cf6653a153c1,080-007421,-82.916268,40.100353
"Pro Sign Repair, Inc.","Pro Sign Repair, Inc.",,613430474,"2100 MCGAW RD, OBETZ, OH 43207",www.prosignandgraphics.com,6144090267,811412,Appliance Repair and Maintenance,76990000,"Repair services, nec",1,2005,Single Location,2000 Mcgaw Rd,Obetz,OH,43207,2100 Mcgaw Rd,Obetz,OH,43207,66173ce4-f10b-59a3-9a77-1ef3885a30ab,152-000187,-82.948513,39.869383
ID Clean Solutions LLC,ID Clean Solutions LLC,,089890742,"2580 WESTBELT DR, COLUMBUS, OH 43228",www.idcleansolutions.com,,561790,Other Services to Buildings and Dwellings,76991700,Cleaning services,1,2020,Single Location,2580 Westbelt Dr,Columbus,OH,43228,2580 Westbelt Dr,Columbus,OH,43228,40dcb164-dce7-55ba-ab27-c65e7886aa34,560-113803,-83.120574,40.006272
"SOS Productions, Inc.","SOS Productions, Inc.",SOS Video Communication,022651145,"2580 WESTBELT DR, COLUMBUS, OH 43228",www.sostv.com,6142210966,512110,Motion Picture and Video Production,78120200,Video production,11,1981,HQ,2580 Westbelt Dr,Columbus,OH,43228,2580 Westbelt Dr,Columbus,OH,43228,40dcb164-dce7-55ba-ab27-c65e7886aa34,560-113803,-83.120574,40.006272
Kreber NC LLC,Kreber NC LLC,,111192205,"2580 WESTBELT DR, COLUMBUS, OH 43228",www.kreber.com,,541613,Marketing Consulting Services,87420300,Marketing consulting services,1,2010,Single Location,2580 Westbelt Dr,Columbus,OH,43228,2580 Westbelt Dr,Columbus,OH,43228,40dcb164-dce7-55ba-ab27-c65e7886aa34,560-113803,-83.120574,40.006272
The Hoster Graphics Company Inc,The Hoster Graphics Company Inc,Advance Graphics,004311874,"2580 WESTBELT DR, COLUMBUS, OH 43228",www.advancecolumbus.com,6142999770,323111,Commercial Printing (except Screen and Books),27520101,Offset printing,13,1989,Single Location,2580 Westbelt Dr,Columbus,OH,43228,2580 Westbelt Dr,Columbus,OH,43228,40dcb164-dce7-55ba-ab27-c65e7886aa34,560-113803,-83.120574,40.006272
Retail Project Management Inc.,Retail Project Management Inc.,Innovative Displays,118840779,"2580 WESTBELT DR, COLUMBUS, OH 43228",,6142999880,325910,Printing Ink Manufacturing,28930000,Printing ink,2,2022,Single Location,2580 Westbelt Dr,Columbus,OH,43228,2580 Westbelt Dr,Columbus,OH,43228,40dcb164-dce7-55ba-ab27-c65e7886aa34,560-113803,-83.120574,40.006272
"Innovative Graphics, Ltd.","Innovative Graphics, Ltd.",,117490152,"2580 WESTBELT DR, COLUMBUS, OH 43228",,8774063636,323111,Commercial Printing (except Screen and Books),27520000,"Commercial printing, lithographic",13,2018,Single Location,2580 Westbelt Dr,Columbus,OH,43228,2580 Westbelt Dr,Columbus,OH,43228,40dcb164-dce7-55ba-ab27-c65e7886aa34,560-113803,-83.120574,40.006272
"Kreber Graphics, Inc.","Kreber Graphics, Inc.",,004281937,"2580 WESTBELT DR, COLUMBUS, OH 43228",www.kreber.com,6145295701,541810,Advertising Agencies,73119901,Advertising consultant,90,1947,HQ,2580 Westbelt Dr,Columbus,OH,43228,2580 Westbelt Dr,Columbus,OH,43228,40dcb164-dce7-55ba-ab27-c65e7886aa34,560-113803,-83.120574,40.006272
Dooley Heating AC,Dooley Heating AC,,029906720,"3671 INTERCHANGE RD, COLUMBUS, OH 43204",,6142789944,238220,"Plumbing, Heating, and Air-Conditioning Contractors",17110405,Warm air heating and air conditioning contractor,2,2013,Single Location,3739 Interchange Rd,Columbus,OH,43204,3671 Interchange Rd,Columbus,OH,43204,788fa8ac-50b4-5619-b0c9-8c808509b772,570-123469,-83.103782,39.972663
Ohio State Optical Company Inc,Ohio State Optical Company Inc,,017909672,"3671 INTERCHANGE RD, COLUMBUS, OH 43204",www.ohiostateoptical.com,,456130,Optical Goods Retailers,59959902,"Eyeglasses, prescription",5,1925,HQ,3683 Interchange Rd,Columbus,OH,43204,3671 Interchange Rd,Columbus,OH,43204,788fa8ac-50b4-5619-b0c9-8c808509b772,570-123469,-83.103124,39.973006
Leafguard Columbus-Dayton,Leafguard Columbus-Dayton,Leafguard Columbus-Dayton,086379049,"3671 INTERCHANGE RD, COLUMBUS, OH 43204",www.leafguard.com,,238390,Other Building Finishing Contractors,17610101,Gutter and downspout contractor,7,2015,Single Location,3687 Interchange Rd,Columbus,OH,43204,3671 Interchange Rd,Columbus,OH,43204,788fa8ac-50b4-5619-b0c9-8c808509b772,570-123469,-83.103158,39.972912
Sewa Homehealth Care LLC,Sewa Homehealth Care LLC,,120332883,"3671 INTERCHANGE RD, COLUMBUS, OH 43204",,,621610,Home Health Care Services,80820000,Home health care services,8,2022,Single Location,3739 Interchange Rd Ste 1,Columbus,OH,43204,3671 Interchange Rd,Columbus,OH,43204,788fa8ac-50b4-5619-b0c9-8c808509b772,570-123469,-83.103782,39.972663
Jimenez Mattress Corp,Jimenez Mattress Corp,,090346454,"3671 INTERCHANGE RD, COLUMBUS, OH 43204",,,449110,Furniture Retailers,57120102,Mattresses,2,2015,Single Location,3739 Interchange Rd,Columbus,OH,43204,3671 Interchange Rd,Columbus,OH,43204,788fa8ac-50b4-5619-b0c9-8c808509b772,570-123469,-83.103782,39.972663
"Premier Courier, Inc.","Premier Courier, Inc.",,155738891,"3671 INTERCHANGE RD, COLUMBUS, OH 43204",www.premiercourier.com,6142464112,492210,Local Messengers and Local Delivery,42159903,"Package delivery, vehicular",15,1987,HQ,3687 Interchange Rd,Columbus,OH,43204,3671 Interchange Rd,Columbus,OH,43204,788fa8ac-50b4-5619-b0c9-8c808509b772,570-123469,-83.103158,39.972912
"Aurora Casket Company, LLC","Aurora Casket Company, LLC",Aurora Casket Company,183436732,"3671 INTERCHANGE RD, COLUMBUS, OH 43204",www.matthewsaurora.com,,423850,Service Establishment Equipment and Supplies Merchant Wholesalers,50870601,Caskets,2,,Branch,3687 Interchange Rd,Columbus,OH,43204,3671 Interchange Rd,Columbus,OH,43204,788fa8ac-50b4-5619-b0c9-8c808509b772,570-123469,-83.103158,39.972912
Midwest Elevator Company Inc,Midwest Elevator Company Inc,,109969999,"3671 INTERCHANGE RD, COLUMBUS, OH 43204",www.midwestelevator.com,6143626885,423830,Industrial Machinery and Equipment Merchant Wholesalers,50840803,Elevators,2,2019,Single Location,880 Kaderly Dr,Columbus,OH,43228,3671 Interchange Rd,Columbus,OH,43204,788fa8ac-50b4-5619-b0c9-8c808509b772,570-123469,-83.104378,39.97273
Exhibitsource,Exhibitsource,,166767165,"3671 INTERCHANGE RD, COLUMBUS, OH 43204",,,561920,Convention and Trade Show Organizers,73890308,Promoters of shows and exhibitions,12,2004,Single Location,3695 Interchange Rd,Columbus,OH,43204,3671 Interchange Rd,Columbus,OH,43204,788fa8ac-50b4-5619-b0c9-8c808509b772,570-123469,-83.10321,39.972701
All Star Truck Driving School Inc.,All Star Truck Driving School Inc.,,083455598,"3671 INTERCHANGE RD, COLUMBUS, OH 43204",,,611692,Automobile Driving Schools,82990400,Vehicle driving school,1,2021,Single Location,3743 Interchange Rd,Columbus,OH,43204,3671 Interchange Rd,Columbus,OH,43204,788fa8ac-50b4-5619-b0c9-8c808509b772,570-123469,-83.103814,39.972552
"Auto-Chlor System of Washington, Inc.","Auto-Chlor System of Washington, Inc.",,033146439,"3671 INTERCHANGE RD, COLUMBUS, OH 43204",www.autochlor.com,7403625599,332813,"Electroplating, Plating, Polishing, Anodizing, and Coloring",34710202,Cleaning and descaling Metal products,1,,Branch,3691 Interchange Rd,Columbus,OH,43204,3671 Interchange Rd,Columbus,OH,43204,788fa8ac-50b4-5619-b0c9-8c808509b772,570-123469,-83.103187,39.972819
"Essilor Laboratories of America, Inc.","Essilor Laboratories of America, Inc.",Top Network,829701643,"3671 INTERCHANGE RD, COLUMBUS, OH 43204",www.essilorusa.com,6142740840,339115,Ophthalmic Goods Manufacturing,38510101,"Eyeglasses, lenses and frames",45,,Branch,3671 Interchange Rd,Columbus,OH,43204,3671 Interchange Rd,Columbus,OH,43204,788fa8ac-50b4-5619-b0c9-8c808509b772,570-123469,-83.103857,39.973082
"Ocean Providence Columbus, LLC","Ocean Providence Columbus, LLC",,043415802,"3671 INTERCHANGE RD, COLUMBUS, OH 43204",www.oceanprovidence.com,6142725973,311119,Other Animal Food Manufacturing,20489909,Fish food,3,2013,Single Location,3699 Interchange Rd,Columbus,OH,43204,3671 Interchange Rd,Columbus,OH,43204,788fa8ac-50b4-5619-b0c9-8c808509b772,570-123469,-83.103238,39.972594
"Metro Laundry, LLC","Metro Laundry, LLC",,159086029,"3671 INTERCHANGE RD, COLUMBUS, OH 43204",www.metrolaundryservice.biz,,999990,Unclassified Establishments,99990000,Nonclassifiable establishments,10,2003,Single Location,3707 Interchange Rd,Columbus,OH,43204,3671 Interchange Rd,Columbus,OH,43204,788fa8ac-50b4-5619-b0c9-8c808509b772,570-123469,-83.103899,39.973614
Bhullar Transport Group LLC,Bhullar Transport Group LLC,,061650577,"3671 INTERCHANGE RD, COLUMBUS, OH 43204",,6147213231,488210,Support Activities for Rail Transportation,47890100,Cargo loading and unloading services,1,2019,Single Location,3739 Interchange Rd,Columbus,OH,43204,3671 Interchange Rd,Columbus,OH,43204,788fa8ac-50b4-5619-b0c9-8c808509b772,570-123469,-83.103782,39.972663
Auto Core Systems,Auto Core Systems,,957871150,"3671 INTERCHANGE RD, COLUMBUS, OH 43204",,7403625599,332813,"Electroplating, Plating, Polishing, Anodizing, and Coloring",34710202,Cleaning and descaling Metal products,3,2009,Single Location,3691 Interchange Rd,Columbus,OH,43204,3671 Interchange Rd,Columbus,OH,43204,788fa8ac-50b4-5619-b0c9-8c808509b772,570-123469,-83.103187,39.972819
"Jf Acquisition, LLC","Jf Acquisition, LLC",,176738896,"3671 INTERCHANGE RD, COLUMBUS, OH 43204",,8664811976,423850,Service Establishment Equipment and Supplies Merchant Wholesalers,50870000,Service establishment equipment,7,,Branch,3743 Interchange Rd,Columbus,OH,43204,3671 Interchange Rd,Columbus,OH,43204,788fa8ac-50b4-5619-b0c9-8c808509b772,570-123469,-83.103814,39.972552
Cs Bhullar Cricket Foundation,Cs Bhullar Cricket Foundation,,120385396,"3671 INTERCHANGE RD, COLUMBUS, OH 43204",,,813211,Grantmaking Foundations,67320000,"Trusts: educational, religious, etc.",2,2022,Single Location,3739 Interchange Rd,Columbus,OH,43204,3671 Interchange Rd,Columbus,OH,43204,788fa8ac-50b4-5619-b0c9-8c808509b772,570-123469,-83.103782,39.972663
New Aqua LLC,New Aqua LLC,New Aqua LLC,025179901,"3671 INTERCHANGE RD, COLUMBUS, OH 43204",www.ilovemywater.com,6142659000,333310,Commercial and Service Industry Machinery Manufacturing,35890304,"Water filters and softeners, household type",3,,Branch,3707 Interchange Rd,Columbus,OH,43204,3671 Interchange Rd,Columbus,OH,43204,788fa8ac-50b4-5619-b0c9-8c808509b772,570-123469,-83.103899,39.973614
Korman Construction Corp,Korman Construction Corp,,961685328,"3671 INTERCHANGE RD, COLUMBUS, OH 43204",www.kormansiding.com,6142742170,238160,Roofing Contractors,17610103,Roofing contractor,18,1996,Single Location,3695 Interchange Rd,Columbus,OH,43204,3671 Interchange Rd,Columbus,OH,43204,788fa8ac-50b4-5619-b0c9-8c808509b772,570-123469,-83.10321,39.972701
Premier Delivery Services,Premier Delivery Services,,024311182,"3671 INTERCHANGE RD, COLUMBUS, OH 43204",www.couriercolumbus.com,6142545182,484110,"General Freight Trucking, Local",42129903,"Delivery service, vehicular",2,2016,Single Location,3687 Interchange Rd Ste G,Columbus,OH,43204,3671 Interchange Rd,Columbus,OH,43204,788fa8ac-50b4-5619-b0c9-8c808509b772,570-123469,-83.103158,39.972912
"Ohio Basement Authority, LLC","Ohio Basement Authority, LLC",Ohio Basement Authority,054761037,"2419 MCGAW RD, OBETZ, OH 43207",www.ohiobasementauthority.com,6142390100,238990,All Other Specialty Trade Contractors,17990209,Waterproofing,10,2010,HQ,2421 Mcgaw Rd,Obetz,OH,43207,2419 Mcgaw Rd,Obetz,OH,43207,20b4789c-0271-53c8-8a9f-4b97b9862328,152-000257,-82.940624,39.866645
"Coyote Run, LLC","Coyote Run, LLC",,062766291,"4343 S HAMILTON RD, GROVEPORT, OH 43125",,,999990,Unclassified Establishments,99992222,"Duns Support Record, nonclassifiable establishment",7,2010,Single Location,4343 S Hamilton Rd,Groveport,OH,43125,4343 S Hamilton Rd,Groveport,OH,43125,3957ca13-d08d-5d06-b420-3ab53730956d,185-001372,-82.884247,39.885383
"4343 South Hamilton Road, LLC","4343 South Hamilton Road, LLC",,027756024,"4343 S HAMILTON RD, GROVEPORT, OH 43125",www.haguewater.com,,541618,Other Management Consulting Services,87480000,"Business consulting, nec",2,2010,Single Location,4343 S Hamilton Rd,Groveport,OH,43125,4343 S Hamilton Rd,Groveport,OH,43125,3957ca13-d08d-5d06-b420-3ab53730956d,185-001372,-82.884247,39.885383
"107 State Route 508, LLC","107 State Route 508, LLC",,122377774,"4343 S HAMILTON RD, GROVEPORT, OH 43125",,,999990,Unclassified Establishments,99992222,"Duns Support Record, nonclassifiable establishment",7,2016,Single Location,4343 S Hamilton Rd,Groveport,OH,43125,4343 S Hamilton Rd,Groveport,OH,43125,3957ca13-d08d-5d06-b420-3ab53730956d,185-001372,-82.884247,39.885383
"William R. Hague, Inc.","William R. Hague, Inc.",Hague Quality Water Intl,017895129,"4343 S HAMILTON RD, GROVEPORT, OH 43125",www.haguewater.com,6148362115,459999,All Other Miscellaneous Retailers,59999929,Water purification equipment,100,1964,Single Location,4343 S Hamilton Rd,Groveport,OH,43125,4343 S Hamilton Rd,Groveport,OH,43125,3957ca13-d08d-5d06-b420-3ab53730956d,185-001372,-82.884247,39.885383
Joerns LLC,Joerns LLC,,115676770,"320 OUTERBELT ST, COLUMBUS, OH 43213",www.joerns.com,5024158573,621999,All Other Miscellaneous Ambulatory Health Care Services,80990000,"Health and allied services, nec",2,2018,Single Location,320 Outerbelt St Ste A,Columbus,OH,43213,320 Outerbelt St,Columbus,OH,43213,f609a62e-64ef-5ac1-818e-2322c1e7b7ff,520-143651,-82.830146,39.987278
"Lifetree Sciences, LLC","Lifetree Sciences, LLC",,090406705,"320 OUTERBELT ST, COLUMBUS, OH 43213",,,999990,Unclassified Establishments,99992222,"Duns Support Record, nonclassifiable establishment",7,2021,Single Location,320 Outerbelt St Ste J,Columbus,OH,43213,320 Outerbelt St,Columbus,OH,43213,f609a62e-64ef-5ac1-818e-2322c1e7b7ff,520-143651,-82.829785,39.987538
Fishman Flooring Solutions,Fishman Flooring Solutions,,030202023,"320 OUTERBELT ST, COLUMBUS, OH 43213",www.lfishman.com,6143221393,423220,Home Furnishing Merchant Wholesalers,50230400,Floor coverings,2,2019,Single Location,320 Outerbelt St Ste D,Columbus,OH,43213,320 Outerbelt St,Columbus,OH,43213,f609a62e-64ef-5ac1-818e-2322c1e7b7ff,520-143651,-82.830146,39.987278
Alro Steel Corporation,Alro Steel Corporation,,157642674,"555 HILLIARD ROME RD, COLUMBUS, OH 43228",www.alro.com,6148787271,423510,Metal Service Centers and Other Metal Merchant Wholesalers,50510216,Steel,32,,Branch,555 Hilliard Rome Rd,Columbus,OH,43228,555 Hilliard Rome Rd,Columbus,OH,43228,9f679ec6-1de1-5720-b22e-5ec9536a6a32,570-106004,-83.147251,39.961273
"Cap & Associates, Inc.","Cap & Associates, Inc.",,097544308,"445 MCCORMICK BLVD, COLUMBUS, OH 43213",www.capfixtures.com,6148633363,337212,Custom Architectural Woodwork and Millwork Manufacturing,25410106,"Store fixtures, wood",170,1981,Single Location,445 Mccormick Blvd,Columbus,OH,43213,445 Mccormick Blvd,Columbus,OH,43213,e41a66b1-afbc-5afb-a349-adfd542a0ceb,520-187784,-82.827156,39.98986
Action Crash Parts,Action Crash Parts,,801600953,"2040 S HAMILTON RD, COLUMBUS, OH 43232",,6144342800,999990,Unclassified Establishments,99990000,Nonclassifiable establishments,0,1998,Single Location,2040 S Hamilton Rd,Columbus,OH,43232,2040 S Hamilton Rd,Columbus,OH,43232,742aad2b-b0b5-5fd9-85ff-b0ef18e1999b,010-115670,-82.877521,39.933165
Columbus Pallets Inc,Columbus Pallets Inc,,078438767,"2040 S HAMILTON RD, COLUMBUS, OH 43232",,6144445411,999990,Unclassified Establishments,99990000,Nonclassifiable establishments,0,2010,Single Location,2040 S Hamilton Rd,Columbus,OH,43232,2040 S Hamilton Rd,Columbus,OH,43232,742aad2b-b0b5-5fd9-85ff-b0ef18e1999b,010-115670,-82.877521,39.933165
"Global Trade Alliance, Inc.","Global Trade Alliance, Inc.",,148621832,"2040 S HAMILTON RD, COLUMBUS, OH 43232",,6147513100,441330,Automotive Parts and Accessories Retailers,55310103,Automotive parts,154,2004,HQ,2040 S Hamilton Rd,Columbus,OH,43232,2040 S Hamilton Rd,Columbus,OH,43232,742aad2b-b0b5-5fd9-85ff-b0ef18e1999b,010-115670,-82.877521,39.933165
"Carleton Circle Apartments of Cumberland County, Ltd.","Carleton Circle Apartments of Cumberland County, Ltd.",,122849195,"2040 S HAMILTON RD, COLUMBUS, OH 43232",,,531110,Lessors of Residential Buildings and Dwellings,65130000,Apartment building operators,2,2016,Single Location,2040 S Hamilton Rd,Columbus,OH,43232,2040 S Hamilton Rd,Columbus,OH,43232,742aad2b-b0b5-5fd9-85ff-b0ef18e1999b,010-115670,-82.877521,39.933165
PRI Value Insurance & Financia,PRI Value Insurance & Financia,Nationwide,021538617,"5075 WESTERVILLE RD, COLUMBUS, OH 43231",www.privalueinsurance.com,,524210,Insurance Agencies and Brokerages,64110301,"Insurance agents, nec",3,2008,Single Location,5089 Westerville Rd,Columbus,OH,43231,5075 Westerville Rd,Columbus,OH,43231,afe1887f-b410-57e1-866a-7faeb4ddbaf4,600-105961,-82.929503,40.076038
Kapp Star LLC,Kapp Star LLC,,075619562,"5075 WESTERVILLE RD, COLUMBUS, OH 43231",,,999990,Unclassified Establishments,99992222,"Duns Support Record, nonclassifiable establishment",7,2019,Single Location,5087 Westerville Rd Ste B,Columbus,OH,43231,5075 Westerville Rd,Columbus,OH,43231,afe1887f-b410-57e1-866a-7faeb4ddbaf4,600-105961,-82.929503,40.076038
A J Westerville Property,A J Westerville Property,,084160093,"5075 WESTERVILLE RD, COLUMBUS, OH 43231",,6146746949,531312,Nonresidential Property Managers,65120000,Nonresidential building operators,2,2017,Single Location,5075 Westerville Rd,Columbus,OH,43231,5075 Westerville Rd,Columbus,OH,43231,afe1887f-b410-57e1-866a-7faeb4ddbaf4,600-105961,-82.929503,40.076038
"Thermal Industries, Inc.","Thermal Industries, Inc.",,084442670,"5075 WESTERVILLE RD, COLUMBUS, OH 43231",,,339999,All Other Miscellaneous Manufacturing,39990000,"Manufacturing industries, nec",2,2017,Single Location,5095 Westerville Rd,Columbus,OH,43231,5075 Westerville Rd,Columbus,OH,43231,afe1887f-b410-57e1-866a-7faeb4ddbaf4,600-105961,-82.929264,40.076676
Inn Associates Columbus L P,Inn Associates Columbus L P,,106183326,"5075 WESTERVILLE RD, COLUMBUS, OH 43231",,,721191,Bed-and-Breakfast Inns,70110400,Inns,2,2016,Single Location,5085 Westerville Rd,Columbus,OH,43231,5075 Westerville Rd,Columbus,OH,43231,afe1887f-b410-57e1-866a-7faeb4ddbaf4,600-105961,-82.930272,40.075783
Ohio Bingo Supply LLC,Ohio Bingo Supply LLC,,084799388,"5075 WESTERVILLE RD, COLUMBUS, OH 43231",,,423990,Other Miscellaneous Durable Goods Merchant Wholesalers,50990000,"Durable goods, nec",1,2013,Single Location,5095 Westerville Rd,Columbus,OH,43231,5075 Westerville Rd,Columbus,OH,43231,afe1887f-b410-57e1-866a-7faeb4ddbaf4,600-105961,-82.929264,40.076676
Barkaw Ltd,Barkaw Ltd,,070948780,"5075 WESTERVILLE RD, COLUMBUS, OH 43231",www.barkaw.com,6149011333,423830,Industrial Machinery and Equipment Merchant Wholesalers,50840000,Industrial machinery and equipment,2,2011,Single Location,5087 Westerville Rd,Columbus,OH,43231,5075 Westerville Rd,Columbus,OH,43231,afe1887f-b410-57e1-866a-7faeb4ddbaf4,600-105961,-82.929503,40.076038
"5454 Cleveland Holdings, LLC","5454 Cleveland Holdings, LLC",,061768983,"5075 WESTERVILLE RD, COLUMBUS, OH 43231",,,999990,Unclassified Establishments,99992222,"Duns Support Record, nonclassifiable establishment",7,2018,Single Location,5087 Westerville Rd Ste B,Columbus,OH,43231,5075 Westerville Rd,Columbus,OH,43231,afe1887f-b410-57e1-866a-7faeb4ddbaf4,600-105961,-82.929503,40.076038
Upper Arlington Insurance,Upper Arlington Insurance,,081765469,"5075 WESTERVILLE RD, COLUMBUS, OH 43231",,6147253148,524210,Insurance Agencies and Brokerages,64110000,"Insurance agents, brokers, and service",2,2017,Single Location,5089 Westerville Rd,Columbus,OH,43231,5075 Westerville Rd,Columbus,OH,43231,afe1887f-b410-57e1-866a-7faeb4ddbaf4,600-105961,-82.929503,40.076038
Patina Properties LLC,Patina Properties LLC,,120618992,"5075 WESTERVILLE RD, COLUMBUS, OH 43231",,,531312,Nonresidential Property Managers,65120000,Nonresidential building operators,2,2022,Single Location,5083 Westerville Rd,Columbus,OH,43231,5075 Westerville Rd,Columbus,OH,43231,afe1887f-b410-57e1-866a-7faeb4ddbaf4,600-105961,-82.929296,40.075587
Nest Tenders Limited,Nest Tenders Limited,Two Men & A Truck,825072697,"5075 WESTERVILLE RD, COLUMBUS, OH 43231",www.twomenandatruck.com,6149011570,484210,Used Household and Office Goods Moving,42120400,Moving services,100,1993,Single Location,5083 Westerville Rd,Columbus,OH,43231,5075 Westerville Rd,Columbus,OH,43231,afe1887f-b410-57e1-866a-7faeb4ddbaf4,600-105961,-82.929296,40.075587
Afri-Net Center For Global Integration,Afri-Net Center For Global Integration,,041064595,"5075 WESTERVILLE RD, COLUMBUS, OH 43231",,6145893823,813410,Civic and Social Organizations,86999904,Charitable organization,6,2013,Single Location,5091 Westerville Rd,Columbus,OH,43231,5075 Westerville Rd,Columbus,OH,43231,afe1887f-b410-57e1-866a-7faeb4ddbaf4,600-105961,-82.929276,40.076173
Ohio Department of Natural Resources,Ohio Department of Natural Resources,Division of Watercraft,082104436,"5075 WESTERVILLE RD, COLUMBUS, OH 43231",senr.osu.edu,,924120,Administration of Conservation Programs,95120402,"Land, mineral, and wildlife conservation, State government",21,,Branch,5095 Westerville Rd,Columbus,OH,43231,5075 Westerville Rd,Columbus,OH,43231,afe1887f-b410-57e1-866a-7faeb4ddbaf4,600-105961,-82.929264,40.076676
"Mobile-Shop Company, LLC","Mobile-Shop Company, LLC",,148286110,"5075 WESTERVILLE RD, COLUMBUS, OH 43231",www.mobile-shop.com,6148828680,444140,Hardware Retailers,52510100,Tools,15,2004,HQ,5089 Westerville Rd,Columbus,OH,43231,5075 Westerville Rd,Columbus,OH,43231,afe1887f-b410-57e1-866a-7faeb4ddbaf4,600-105961,-71.463208,42.762078
